id,name,status,fit,score,best_use,risk,required_proof,next_action
P-001,Decidim specialist provider,Recommended,Best fit,88,First fake-data sandbox build where Decidim-specific setup and admin handover matter most,Higher cash cost but lower delivery risk,Live Decidim examples; version plan; hosting plan; admin handover; acceptance evidence; AGPL/source-code note,Send RFQ first
P-002,Ruby on Rails civic tech studio,Recommended,Good fit,78,Provider with strong Rails and PostgreSQL skills that can prove Decidim capability,May underestimate Decidim configuration or AGPL obligations,Rails references; Decidim learning plan; deployment plan; QA approach; handover evidence,Send RFQ with Decidim proof request
P-003,Partner-hosted civic organisation,Hold,Conditional,70,Trusted partner can host and support under Barayamal oversight,Control admin access backups and handover can become unclear,Partner role note; admin owner; backup owner; support owner; export path; assurance sign-off,Hold until governance controls are explicit
P-004,Cloud DevOps plus Rails contractor,Hold,Technical support,64,Infrastructure setup paired with a separate Decidim application owner,May solve hosting while leaving participation configuration weak,Infrastructure diagram; backup plan; monitoring note; access plan; named Decidim app owner,Use only with Decidim-capable lead
P-005,Barayamal self-build coach,Hold,Capability build,66,Coaching path for long-term maintainership and self-build skills,Slower first sandbox and still blocked by runtime prerequisites,Pairing plan; environment setup; documentation; fallback provider path,Use if capability building is the priority
P-006,Static-only web contractor,No-go,Poor fit,35,Public demo polish only not Decidim sandbox build,Could produce another mockup instead of a Decidim app,Proof of Decidim app capability before reconsideration,Do not use for sandbox build
